{
  "schema": "layoutabi_pointer_audit_v1",
  "schema_version": 1,
  "device": {
    "name": "Orin",
    "compute_capability": "8.7",
    "sm_count": 8
  },
  "software": {
    "torch": "2.7.0",
    "cuda_build": "12.8"
  },
  "protocol": {
    "dtype": "fp16",
    "batch": 1,
    "heads": 4,
    "head_dim": 8,
    "ns": [
      65536,
      65538,
      65540,
      65543
    ],
    "offsets_mod64_bytes": [
      0,
      2,
      4,
      8,
      16
    ],
    "operand_grid": "full Cartesian product of K and V pointer residues",
    "cycles": 12,
    "iterations_per_measurement": 20,
    "order": "rotating and alternating-direction offset-pair order",
    "setup_copy_measured": false,
    "correctness_gate": "max_abs <= tolerance OR relative_inf <= tolerance",
    "profiler_collection": "one subprocess and one Kineto session per N"
  },
  "points": [
    {
      "n": 65536,
      "n_mod_8": 0,
      "n_class": "fastest",
      "rows": [
        {
          "k_offset_bytes": 0,
          "v_offset_bytes": 0,
          "k_pointer": {
            "requested_mod64": 0,
            "actual_mod64": 0,
            "actual_mod16": 0,
            "actual_mod8": 0,
            "actual_mod4": 0,
            "base_mod64": 0,
            "storage_offset_elements": 0
          },
          "v_pointer": {
            "requested_mod64": 0,
            "actual_mod64": 0,
            "actual_mod16": 0,
            "actual_mod8": 0,
            "actual_mod4": 0,
            "base_mod64": 0,
            "storage_offset_elements": 0
          },
          "k_stride": [
            2097152,
            524288,
            65536,
            1
          ],
          "v_stride": [
            2097152,
            524288,
            8,
            1
          ],
          "correctness": {
            "max_abs": 0.0,
            "relative_inf": 0.0,
            "tolerance": 0.08,
            "pass": true
          },
          "timing": {
            "n": 12,
            "median_ms": 0.3500911951065063,
            "mean_ms": 0.3498951991399129,
            "min_ms": 0.3466207981109619,
            "max_ms": 0.3506688117980957
          },
          "profiler": {
            "available": true,
            "selected_cuda_names": [
              "ampere_fp16_s16816gemm_fp16_64x64_sliced1x2_ldg8_f2f_stages_64x5_nn"
            ],
            "family": "ldg8",
            "collection": "single_session_launch_order"
          }
        },
        {
          "k_offset_bytes": 0,
          "v_offset_bytes": 2,
          "k_pointer": {
            "requested_mod64": 0,
            "actual_mod64": 0,
            "actual_mod16": 0,
            "actual_mod8": 0,
            "actual_mod4": 0,
            "base_mod64": 0,
            "storage_offset_elements": 0
          },
          "v_pointer": {
            "requested_mod64": 2,
            "actual_mod64": 2,
            "actual_mod16": 2,
            "actual_mod8": 2,
            "actual_mod4": 2,
            "base_mod64": 0,
            "storage_offset_elements": 1
          },
          "k_stride": [
            2097152,
            524288,
            65536,
            1
          ],
          "v_stride": [
            2097152,
            524288,
            8,
            1
          ],
          "correctness": {
            "max_abs": 0.25,
            "relative_inf": 0.00033829499323410016,
            "tolerance": 0.08,
            "pass": true
          },
          "timing": {
            "n": 12,
            "median_ms": 1.4424320220947267,
            "mean_ms": 1.442786407470703,
            "min_ms": 1.441988754272461,
            "max_ms": 1.4445216178894043
          },
          "profiler": {
            "available": true,
            "selected_cuda_names": [
              "void cutlass::Kernel2<cutlass_75_wmma_tensorop_f16_s161616gemm_f16_32x32_128x2_nn_align1>(cutlass_75_wmma_tensorop_f16_s161616gemm_f16_32x32_128x2_nn_align1::Params)"
            ],
            "family": "align1",
            "collection": "single_session_launch_order"
          }
        },
        {
          "k_offset_bytes": 0,
          "v_offset_bytes": 4,
          "k_pointer": {
            "requested_mod64": 0,
            "actual_mod64": 0,
            "actual_mod16": 0,
            "actual_mod8": 0,
            "actual_mod4": 0,
            "base_mod64": 0,
            "storage_offset_elements": 0
          },
          "v_pointer": {
            "requested_mod64": 4,
            "actual_mod64": 4,
            "actual_mod16": 4,
            "actual_mod8": 4,
            "actual_mod4": 0,
            "base_mod64": 0,
            "storage_offset_elements": 2
          },
          "k_stride": [
            2097152,
            524288,
            65536,
            1
          ],
          "v_stride": [
            2097152,
            524288,
            8,
            1
          ],
          "correctness": {
            "max_abs": 0.25,
            "relative_inf": 0.00033829499323410016,
            "tolerance": 0.08,
            "pass": true
          },
          "timing": {
            "n": 12,
            "median_ms": 0.6399351835250855,
            "mean_ms": 0.6400142629941304,
            "min_ms": 0.6394239902496338,
            "max_ms": 0.641542387008667
          },
          "profiler": {
            "available": true,
            "selected_cuda_names": [
              "void cutlass::Kernel2<cutlass_80_wmma_tensorop_f16_s161616gemm_f16_32x32_128x2_nn_align2>(cutlass_80_wmma_tensorop_f16_s161616gemm_f16_32x32_128x2_nn_align2::Params)"
            ],
            "family": "align2",
            "collection": "single_session_launch_order"
          }
        },
        {
          "k_offset_bytes": 0,
          "v_offset_bytes": 8,
          "k_pointer": {
            "requested_mod64": 0,
            "actual_mod64": 0,
            "actual_mod16": 0,
            "actual_mod8": 0,
            "actual_mod4": 0,
            "base_mod64": 0,
            "storage_offset_elements": 0
          },
          "v_pointer": {
            "requested_mod64": 8,
            "actual_mod64": 8,
            "actual_mod16": 8,
            "actual_mod8": 0,
            "actual_mod4": 0,
            "base_mod64": 0,
            "storage_offset_elements": 4
          },
          "k_stride": [
            2097152,
            524288,
            65536,
            1
          ],
          "v_stride": [
            2097152,
            524288,
            8,
            1
          ],
          "correctness": {
            "max_abs": 0.25,
            "relative_inf": 0.00033829499323410016,
            "tolerance": 0.08,
            "pass": true
          },
          "timing": {
            "n": 12,
            "median_ms": 0.6400311946868897,
            "mean_ms": 0.6399810671806335,
            "min_ms": 0.6391839981079102,
            "max_ms": 0.6409440040588379
          },
          "profiler": {
            "available": true,
            "selected_cuda_names": [
              "void cutlass::Kernel2<cutlass_80_wmma_tensorop_f16_s161616gemm_f16_32x32_128x2_nn_align2>(cutlass_80_wmma_tensorop_f16_s161616gemm_f16_32x32_128x2_nn_align2::Params)"
            ],
            "family": "align2",
            "collection": "single_session_launch_order"
          }
        },
        {
          "k_offset_bytes": 0,
          "v_offset_bytes": 16,
          "k_pointer": {
            "requested_mod64": 0,
            "actual_mod64": 0,
            "actual_mod16": 0,
            "actual_mod8": 0,
            "actual_mod4": 0,
            "base_mod64": 0,
            "storage_offset_elements": 0
          },
          "v_pointer": {
            "requested_mod64": 16,
            "actual_mod64": 16,
            "actual_mod16": 0,
            "actual_mod8": 0,
            "actual_mod4": 0,
            "base_mod64": 0,
            "storage_offset_elements": 8
          },
          "k_stride": [
            2097152,
            524288,
            65536,
            1
          ],
          "v_stride": [
            2097152,
            524288,
            8,
            1
          ],
          "correctness": {
            "max_abs": 0.0,
            "relative_inf": 0.0,
            "tolerance": 0.08,
            "pass": true
          },
          "timing": {
            "n": 12,
            "median_ms": 0.3506351947784424,
            "mean_ms": 0.35088026722272236,
            "min_ms": 0.35022079944610596,
            "max_ms": 0.35186400413513186
          },
          "profiler": {
            "available": true,
            "selected_cuda_names": [
              "ampere_fp16_s16816gemm_fp16_64x64_sliced1x2_ldg8_f2f_stages_64x5_nn"
            ],
            "family": "ldg8",
            "collection": "single_session_launch_order"
          }
        },
        {
          "k_offset_bytes": 2,
          "v_offset_bytes": 0,
          "k_pointer": {
            "requested_mod64": 2,
            "actual_mod64": 2,
            "actual_mod16": 2,
            "actual_mod8": 2,
            "actual_mod4": 2,
            "base_mod64": 0,
            "storage_offset_elements": 1
          },
          "v_pointer": {
            "requested_mod64": 0,
            "actual_mod64": 0,
            "actual_mod16": 0,
            "actual_mod8": 0,
            "actual_mod4": 0,
            "base_mod64": 0,
            "storage_offset_elements": 0
          },
          "k_stride": [
            2097152,
            524288,
            65536,
            1
          ],
          "v_stride": [
            2097152,
            524288,
            8,
            1
          ],
          "correctness": {
            "max_abs": 0.25,
            "relative_inf": 0.00033829499323410016,
            "tolerance": 0.08,
            "pass": true
          },
          "timing": {
            "n": 12,
            "median_ms": 1.1183760166168213,
            "mean_ms": 1.1187793413798015,
            "min_ms": 1.118017578125,